{
  "belgi_version": "fixture",
  "compilation": {
    "compiled_at": "1970-01-01T00:00:00Z",
    "compiler_id": "fixture",
    "compiler_version": "fixture",
    "source_hashes": [
      "0000000000000000000000000000000000000000000000000000000000000000"
    ]
  },
  "constraints": {
    "allowed_paths": [
      "policy/",
      "tools/"
    ],
    "forbidden_paths": []
  },
  "environment_envelope": {
    "description": "fixture",
    "expected_runner": "fixture",
    "id": "fixture-envelope",
    "pinned_toolchain_refs": [
      {
        "hash": "0000000000000000000000000000000000000000000000000000000000000000",
        "id": "fixture-toolchain",
        "storage_ref": "toolchain.txt"
      }
    ]
  },
  "intent": {
    "intent_id": "intent-q-intent-001-no-yaml",
    "narrative": "Fixture goal",
    "scope": "allowed_dirs: [policy/, tools/]; forbidden_dirs: []; max_touched_files: null; max_loc_delta: null",
    "success_criteria": "- Criteria 1",
    "title": "Fixture intent"
  },
  "invariants": [
    {
      "description": "fixture invariant",
      "id": "INV-001",
      "severity": "fixture"
    }
  ],
  "prompt_bundle_ref": {
    "hash": "0000000000000000000000000000000000000000000000000000000000000000",
    "id": "fixture-prompt-bundle",
    "storage_ref": "prompt_bundle.txt"
  },
  "protocol_pack": {
    "manifest_sha256": "cc83831c6131a3c83cb3b59cf669010d2f25be963708dedcbedf58ced9c2cadf",
    "pack_id": "cec4e70944b14be18198427a13f17368b248a0bd65f3a85642c6734a4020348c",
    "pack_name": "belgi-protocol-pack-v1",
    "source": "builtin"
  },
  "run_id": "q-intent-001-no-yaml",
  "schema_version": "1.0.0",
  "tier": {
    "tier_id": "tier-0",
    "tier_name": "Tier 0",
    "tolerances_ref": {
      "hash": "0000000000000000000000000000000000000000000000000000000000000000",
      "id": "fixture-tolerances",
      "storage_ref": "tolerances.json"
    }
  },
  "upstream_state": {
    "commit_sha": "0000000000000000000000000000000000000000",
    "dirty_flag": false,
    "repo_ref": "fixture"
  }
}
