{
  "belgi_version": "fixture",
  "compilation": {
    "compiled_at": "1970-01-01T00:00:00Z",
    "compiler_id": "fixture",
    "compiler_version": "fixture",
    "source_hashes": [
      "0000000000000000000000000000000000000000000000000000000000000000"
    ]
  },
  "constraints": {
    "allowed_paths": [
      "policy/"
    ],
    "forbidden_paths": [],
    "max_loc_delta": 2500,
    "max_touched_files": 25
  },
  "environment_envelope": {
    "description": "fixture",
    "expected_runner": "fixture",
    "id": "fixture-envelope",
    "pinned_toolchain_refs": [
      {
        "hash": "0000000000000000000000000000000000000000000000000000000000000000",
        "id": "fixture-toolchain",
        "storage_ref": "toolchain.txt"
      }
    ]
  },
  "intent": {
    "intent_id": "intent-r-pass-tier1",
    "narrative": "Fixture goal",
    "scope": "allowed_dirs: [policy/]; forbidden_dirs: []; max_touched_files: 25; max_loc_delta: 2500",
    "success_criteria": "- Criteria 1",
    "title": "Fixture intent"
  },
  "invariants": [
    {
      "description": "fixture invariant",
      "id": "INV-001",
      "severity": "fixture"
    }
  ],
  "prompt_bundle_ref": {
    "hash": "0000000000000000000000000000000000000000000000000000000000000000",
    "id": "fixture-prompt-bundle",
    "storage_ref": "prompt_bundle.txt"
  },
  "protocol_pack": {
    "manifest_sha256": "9731d91ba5b1d4ab9075026354dd99198b238fe202b5d40b7972729b33152b85",
    "pack_id": "6f268249eea831f736804fe8ba36116e4cc6022634c4bae9955de0b0e6e92748",
    "pack_name": "belgi-protocol-pack-v1",
    "source": "builtin"
  },
  "run_id": "r-pass-tier1",
  "schema_version": "1.0.0",
  "tier": {
    "tier_id": "tier-1",
    "tier_name": "Tier 1",
    "tolerances_ref": {
      "hash": "0000000000000000000000000000000000000000000000000000000000000000",
      "id": "fixture-tolerances",
      "storage_ref": "tolerances.json"
    }
  },
  "upstream_state": {
    "commit_sha": "355de04f3dc3d501d6a3bb8dd232e8b345f742cb",
    "dirty_flag": false,
    "repo_ref": "fixture"
  }
}
