{
  "belgi_version": "0.2.0",
  "compilation": {
    "compiled_at": "2000-01-01T00:00:00Z",
    "compiler_id": "C1",
    "compiler_version": "fixture",
    "source_hashes": [
      "0000000000000000000000000000000000000000000000000000000000000000"
    ]
  },
  "constraints": {
    "allowed_paths": [
      "policy/fixtures/public/gate_s/"
    ],
    "forbidden_paths": []
  },
  "environment_envelope": {
    "description": "fixture",
    "expected_runner": "ci:fixture",
    "id": "env-fixture",
    "pinned_toolchain_refs": [
      {
        "hash": "a20318ac0cb4f70c753deac88d2da168b85059aebf211d5bf6315adbc1c360d9",
        "id": "toolchain",
        "storage_ref": "policy/fixtures/public/gate_s/s_pass_tier1_unsigned/toolchain.json"
      }
    ]
  },
  "intent": {
    "intent_id": "fixture",
    "narrative": "fixture",
    "scope": "fixture",
    "success_criteria": "fixture",
    "title": "fixture"
  },
  "invariants": [
    {
      "description": "fixture",
      "id": "inv",
      "severity": "policy"
    }
  ],
  "prompt_bundle_ref": {
    "hash": "be6c703119a676c99a125af587b43d6da35083391c1ac28157e8e3cfa4bbec86",
    "id": "prompt",
    "storage_ref": "policy/fixtures/public/gate_s/s_pass_tier1_unsigned/prompt.json"
  },
  "protocol_pack": {
    "manifest_sha256": "4bf148cd082052eb3923c92b19b9519e8a240a14a8f4f516d177e8ca8c3f17f2",
    "pack_id": "11c4bec2a55b17994cf6cd09065b4c293a1fa18f2ab397955963f854678756fb",
    "pack_name": "belgi-protocol-pack-v1",
    "source": "builtin"
  },
  "run_id": "run-s_pass_tier1_unsigned",
  "schema_version": "1.0.0",
  "tier": {
    "tier_id": "tier-1",
    "tier_name": "Tier 1",
    "tolerances_ref": {
      "hash": "f58ea9e8addce9ded93683073fa85af67a4606bdf060909f0ac550793b42ca96",
      "id": "tolerances",
      "storage_ref": "policy/fixtures/public/gate_s/s_pass_tier1_unsigned/tolerances.json"
    }
  },
  "upstream_state": {
    "commit_sha": "0000000000000000000000000000000000000000",
    "dirty_flag": false,
    "repo_ref": "fixture"
  },
  "waivers_applied": []
}
